### ISSUE TITLE
Every NodePort Service receiving spurious traffic from 10.20.*.0 addresses

### ISSUE THREAD

**Issue by whereisaaron** [kubernetes-incubator/kube-aws#1351]
Seeing something strange with NodePort Services that I don't get on other clusters. Every Pod with a NodePort service is receiving heaps of spurious cluster-internal traffic (as below).

They mostly appear to be final packets of connections. The all come from 10.20.*.0 addresses (ie. ending with 0). These aren't addresses of actually containers, are they some sort of broadcast address? Are these kubelet broadcast addresses? Other pods with ClusterIP addresses are not getting his traffic.

Any idea what causes this?

```
kube-aws 0.9.9
k8s 1.8.13

calicoNodeImage:
  repo: quay.io/calico/node
  tag: v2.6.5
  rktPullDocker: false

calicoCniImage:
  repo: quay.io/calico/cni
  tag: v1.11.4
  rktPullDocker: false

calicoKubeControllersImage:
  repo: quay.io/calico/kube-controllers
  tag: v1.0.2
  rktPullDocker: false

calicoCtlImage:
  repo: calico/ctl
  tag: v1.6.3
  rktPullDocker: false

flannelImage:
  repo: quay.io/coreos/flannel
  tag: v0.9.1
  rktPullDocker: false
```

```
17:21:23.772941 IP 10.20.91.0.8061 > 10.20.112.9.22: Flags [R], seq 1926459861, win 0, length 0
17:21:23.773269 IP 10.20.91.0.8061 > 10.20.112.9.22: Flags [R], seq 1926459861, win 0, length 0
17:21:23.781587 IP 10.20.59.0.2469 > 10.20.112.9.22: Flags [S], seq 3408045702, win 29200, options [mss 1460,sackOK,TS val 717133703 ecr 0,nop,wscale 7], length 0
17:21:23.865935 IP 10.20.20.0.23336 > 10.20.112.9.22: Flags [.], ack 618513893, win 229, options [nop,nop,TS val 731646986 ecr 2005720695], length 0
17:21:23.865999 IP 10.20.20.0.23336 > 10.20.112.9.22: Flags [F.], seq 0, ack 1, win 229, options [nop,nop,TS val 731646986 ecr 2005720695], length 0
17:21:23.891129 IP 10.20.15.0.56289 > 10.20.112.9.22: Flags [.], ack 1501225036, win 229, options [nop,nop,TS val 79758257 ecr 909917797], length 0
17:21:23.891175 IP 10.20.15.0.56289 > 10.20.112.9.22: Flags [F.], seq 0, ack 1, win 229, options [nop,nop,TS val 79758257 ecr 909917797], length 0
17:21:23.899978 IP 10.20.59.0.2469 > 10.20.112.9.22: Flags [.], ack 396129587, win 229, options [nop,nop,TS val 717133732 ecr 1148137412], length 0
17:21:23.899983 IP 10.20.59.0.2469 > 10.20.112.9.22: Flags [F.], seq 0, ack 1, win 229, options [nop,nop,TS val 717133732 ecr 1148137412], length 0
17:21:23.910401 IP 10.20.59.0.37408 > 10.20.112.9.22: Flags [.], ack 3027257372, win 229, options [nop,nop,TS val 717099886 ecr 1148137362], length 0
17:21:23.910449 IP 10.20.59.0.37408 > 10.20.112.9.22: Flags [F.], seq 0, ack 1, win 229, options [nop,nop,TS val 717099886 ecr 1148137362], length 0
17:21:23.934316 IP 10.20.80.0.63127 > 10.20.112.9.22: Flags [.], ack 3178827117, win 229, options [nop,nop,TS val 734646262 ecr 4136675592], length 0
17:21:23.934364 IP 10.20.80.0.63127 > 10.20.112.9.22: Flags [F.], seq 0, ack 1, win 229, options [nop,nop,TS val 734646262 ecr 4136675592], length 0
17:21:23.945787 IP 10.20.20.0.45838 > 10.20.112.9.22: Flags [S], seq 3356397764, win 29200, options [mss 1460,sackOK,TS val 721141482 ecr 0,nop,wscale 7], length 0
17:21:23.967688 IP 10.20.15.0.47843 > 10.20.112.9.22: Flags [R], seq 9628866, win 0, length 0
17:21:23.968094 IP 10.20.15.0.47843 > 10.20.112.9.22: Flags [R], seq 9628866, win 0, length 0
17:21:23.971329 IP 10.20.59.0.64586 > 10.20.112.9.22: Flags [S], seq 3892050859, win 29200, options [mss 1460,sackOK,TS val 79736181 ecr 0,nop,wscale 7], length 0
17:21:23.973512 IP 10.20.59.0.11409 > 10.20.112.9.22: Flags [R], seq 1875574395, win 0, length 0
17:21:23.973775 IP 10.20.59.0.11409 > 10.20.112.9.22: Flags [R], seq 1875574395, win 0, length 0
17:21:24.025128 IP 10.20.59.0.2469 > 10.20.112.9.22: Flags [R], seq 3408045704, win 0, length 0
17:21:24.025886 IP 10.20.59.0.2469 > 10.20.112.9.22: Flags [R], seq 3408045704, win 0, length 0
17:21:24.038901 IP 10.20.20.0.23336 > 10.20.112.9.22: Flags [R], seq 417329288, win 0, length 0
17:21:24.039271 IP 10.20.20.0.23336 > 10.20.112.9.22: Flags [R], seq 417329288, win 0, length 0
17:21:24.067142 IP 10.20.20.0.15041 > 10.20.112.9.22: Flags [S], seq 2492672682, win 29200, options [mss 1460,sackOK,TS val 721140312 ecr 0,nop,wscale 7], length 0
17:21:24.097457 IP 10.20.59.0.37408 > 10.20.112.9.22: Flags [R], seq 3408914226, win 0, length 0
17:21:24.097972 IP 10.20.59.0.37408 > 10.20.112.9.22: Flags [R], seq 3408914226, win 0, length 0
17:21:24.106257 IP 10.20.15.0.56289 > 10.20.112.9.22: Flags [R], seq 4004189869, win 0, length 0
17:21:24.106814 IP 10.20.15.0.56289 > 10.20.112.9.22: Flags [R], seq 4004189869, win 0, length 0
17:21:24.107331 IP 10.20.91.0.63566 > 10.20.112.9.22: Flags [S], seq 3476403215, win 29200, options [mss 1460,sackOK,TS val 721156736 ecr 0,nop,wscale 7], length 0
17:21:24.117742 IP 10.20.91.0.18583 > 10.20.112.9.22: Flags [S], seq 399814757, win 29200, options [mss 1460,sackOK,TS val 738261276 ecr 0,nop,wscale 7], length 0
17:21:24.120663 IP 10.20.80.0.63127 > 10.20.112.9.22: Flags [R], seq 1250924852, win 0, length 0
17:21:24.121071 IP 10.20.80.0.63127 > 10.20.112.9.22: Flags [R], seq 1250924852, win 0, length 0
17:21:24.158991 IP 10.20.109.0.45065 > 10.20.112.9.22: Flags [S], seq 2086869361, win 29200, options [mss 1460,sackOK,TS val 103085611 ecr 0,nop,wscale 7], length 0
17:21:24.177219 IP 10.20.59.0.64586 > 10.20.112.9.22: Flags [.], ack 1675913304, win 229, options [nop,nop,TS val 79736233 ecr 1148137601], length 0
17:21:24.177321 IP 10.20.59.0.64586 > 10.20.112.9.22: Flags [F.], seq 0, ack 1, win 229, options [nop,nop,TS val 79736233 ecr 1148137601], length 0
17:21:24.223115 IP 10.20.20.0.45838 > 10.20.112.9.22: Flags [.], ack 3701664272, win 229, options [nop,nop,TS val 721141552 ecr 2005720939], length 0
17:21:24.223260 IP 10.20.20.0.45838 > 10.20.112.9.22: Flags [F.], seq 0, ack 1, win 229, options [nop,nop,TS val 721141552 ecr 2005720939], length 0
17:21:24.274997 IP 10.20.109.0.45065 > 10.20.112.9.22: Flags [.], ack 968207486, win 229, options [nop,nop,TS val 103085640 ecr 527947270], length 0
17:21:24.275073 IP 10.20.109.0.45065 > 10.20.112.9.22: Flags [F.], seq 0, ack 1, win 229, options [nop,nop,TS val 103085640 ecr 527947270], length 0
17:21:24.386104 IP 10.20.91.0.63566 > 10.20.112.9.22: Flags [.], ack 1129912647, win 229, options [nop,nop,TS val 721156805 ecr 3721516353], length 0
17:21:24.386162 IP 10.20.91.0.63566 > 10.20.112.9.22: Flags [F.], seq 0, ack 1, win 229, options [nop,nop,TS val 721156805 ecr 3721516353], length 0
17:21:24.388619 IP 10.20.59.0.64586 > 10.20.112.9.22: Flags [R], seq 3892050861, win 0, length 0
17:21:24.388894 IP 10.20.59.0.64586 > 10.20.112.9.22: Flags [R], seq 3892050861, win 0, length 0
17:21:24.393903 IP 10.20.20.0.15041 > 10.20.112.9.22: Flags [.], ack 1062906204, win 229, options [nop,nop,TS val 721140394 ecr 2005721060], length 0
17:21:24.393982 IP 10.20.20.0.15041 > 10.20.112.9.22: Flags [F.], seq 0, ack 1, win 229, options [nop,nop,TS val 721140394 ecr 2005721060], length 0
17:21:24.395008 IP 10.20.91.0.18583 > 10.20.112.9.22: Flags [.], ack 485465773, win 229, options [nop,nop,TS val 738261346 ecr 3721516364], length 0
17:21:24.395077 IP 10.20.91.0.18583 > 10.20.112.9.22: Flags [F.], seq 0, ack 1, win 229, options [nop,nop,TS val 738261346 ecr 3721516364], length 0
17:21:24.397306 IP 10.20.109.0.45065 > 10.20.112.9.22: Flags [R], seq 2086869363, win 0, length 0
17:21:24.397615 IP 10.20.109.0.45065 > 10.20.112.9.22: Flags [R], seq 2086869363, win 0, length 0
17:21:24.459021 IP 10.20.43.0.1469 > 10.20.112.9.22: Flags [S], seq 1690107676, win 29200, options [mss 1460,sackOK,TS val 717157307 ecr 0,nop,wscale 7], length 0
17:21:24.460451 IP 10.20.109.0.20837 > 10.20.112.9.22: Flags [S], seq 631530832, win 29200, options [mss 1460,sackOK,TS val 738284704 ecr 0,nop,wscale 7], length 0
17:21:24.486768 IP 10.20.91.0.22570 > 10.20.112.9.22: Flags [S], seq 3706719502, win 29200, options [mss 1460,sackOK,TS val 148724482 ecr 0,nop,wscale 7], length 0
17:21:24.506721 IP 10.20.20.0.45838 > 10.20.112.9.22: Flags [R], seq 3356397766, win 0, length 0
17:21:24.506970 IP 10.20.20.0.45838 > 10.20.112.9.22: Flags [R], seq 3356397766, win 0, length 0
17:21:24.538877 IP 10.20.80.0.11534 > 10.20.112.9.22: Flags [S], seq 525930949, win 29200, options [mss 1460,sackOK,TS val 734650618 ecr 0,nop,wscale 7], length 0
17:21:24.549512 IP 10.20.20.0.17960 > 10.20.112.9.22: Flags [S], seq 3130256671, win 29200, options [mss 1460,sackOK,TS val 738269311 ecr 0,nop,wscale 7], length 0
17:21:24.564858 IP 10.20.43.0.1469 > 10.20.112.9.22: Flags [.], ack 958928869, win 229, options [nop,nop,TS val 717157334 ecr 3505922965], length 0
17:21:24.565046 IP 10.20.43.0.1469 > 10.20.112.9.22: Flags [F.], seq 0, ack 1, win 229, options [nop,nop,TS val 717157334 ecr 3505922965], length 0
17:21:24.574155 IP 10.20.15.0.61061 > 10.20.112.9.22: Flags [S], seq 982072412, win 29200, options [mss 1460,sackOK,TS val 713857281 ecr 0,nop,wscale 7], length 0
17:21:24.610193 IP 10.20.80.0.24200 > 10.20.112.9.22: Flags [S], seq 2003111669, win 29200, options [mss 1460,sackOK,TS val 721141630 ecr 0,nop,wscale 7], length 0
17:21:24.651409 IP 10.20.91.0.22570 > 10.20.112.9.22: Flags [.], ack 2718649352, win 229, options [nop,nop,TS val 148724524 ecr 3721516733], length 0
17:21:24.651468 IP 10.20.91.0.22570 > 10.20.112.9.22: Flags [F.], seq 0, ack 1, win 229, options [nop,nop,TS val 148724524 ecr 3721516733], length 0
17:21:24.671581 IP 10.20.91.0.63566 > 10.20.112.9.22: Flags [R], seq 3476403217, win 0, length 0
17:21:24.671899 IP 10.20.91.0.63566 > 10.20.112.9.22: Flags [R], seq 3476403217, win 0, length 0
17:21:24.676787 IP 10.20.43.0.1469 > 10.20.112.9.22: Flags [R], seq 1690107678, win 0, length 0
17:21:24.677103 IP 10.20.43.0.1469 > 10.20.112.9.22: Flags [R], seq 1690107678, win 0, length 0
17:21:24.681133 IP 10.20.91.0.18583 > 10.20.112.9.22: Flags [R], seq 399814759, win 0, length 0
17:21:24.681411 IP 10.20.91.0.18583 > 10.20.112.9.22: Flags [R], seq 399814759, win 0, length 0
17:21:24.687818 IP 10.20.80.0.11534 > 10.20.112.9.22: Flags [.], ack 1045780653, win 229, options [nop,nop,TS val 734650655 ecr 4136676376], length 0
17:21:24.687821 IP 10.20.80.0.11534 > 10.20.112.9.22: Flags [F.], seq 0, ack 1, win 229, options [nop,nop,TS val 734650655 ecr 4136676376], length 0
17:21:24.728789 IP 10.20.20.0.15041 > 10.20.112.9.22: Flags [R], seq 2492672684, win 0, length 0
17:21:24.729145 IP 10.20.20.0.15041 > 10.20.112.9.22: Flags [R], seq 2492672684, win 0, length 0
17:21:24.736105 IP 10.20.109.0.20837 > 10.20.112.9.22: Flags [.], ack 3619918668, win 229, options [nop,nop,TS val 738284773 ecr 527947572], length 0
17:21:24.736207 IP 10.20.109.0.20837 > 10.20.112.9.22: Flags [F.], seq 0, ack 1, win 229, options [nop,nop,TS val 738284773 ecr 527947572], length 0
17:21:24.746780 IP 10.20.80.0.18382 > 10.20.112.9.22: Flags [S], seq 4226089105, win 29200, options [mss 1460,sackOK,TS val 734681294 ecr 0,nop,wscale 7], length 0
17:21:24.747597 IP 10.20.15.0.2797 > 10.20.112.9.22: Flags [S], seq 1946192037, win 29200, options [mss 1460,sackOK,TS val 109245698 ecr 0,nop,wscale 7], length 0
17:21:24.778823 IP 10.20.15.0.61061 > 10.20.112.9.22: Flags [.], ack 2889793379, win 229, options [nop,nop,TS val 713857332 ecr 909918685], length 0
17:21:24.778908 IP 10.20.15.0.61061 > 10.20.112.9.22: Flags [F.], seq 0, ack 1, win 229, options [nop,nop,TS val 713857332 ecr 909918685], length 0
17:21:24.819296 IP 10.20.57.0.9545 > 10.20.112.9.22: Flags [S], seq 4059636482, win 29200, options [mss 1460,sackOK,TS val 738481555 ecr 0,nop,wscale 7], length 0
17:21:24.822019 IP 10.20.91.0.22570 > 10.20.112.9.22: Flags [R], seq 3706719504, win 0, length 0
17:21:24.822317 IP 10.20.91.0.22570 > 10.20.112.9.22: Flags [R], seq 3706719504, win 0, length 0
17:21:24.825534 IP 10.20.20.0.17960 > 10.20.112.9.22: Flags [.], ack 2793403697, win 229, options [nop,nop,TS val 738269380 ecr 2005721543], length 0
17:21:24.825600 IP 10.20.20.0.17960 > 10.20.112.9.22: Flags [F.], seq 0, ack 1, win 229, options [nop,nop,TS val 738269380 ecr 2005721543], length 0
17:21:24.843069 IP 10.20.80.0.11534 > 10.20.112.9.22: Flags [R], seq 525930951, win 0, length 0
17:21:24.843342 IP 10.20.80.0.11534 > 10.20.112.9.22: Flags [R], seq 525930951, win 0, length 0
17:21:24.850624 IP 10.20.43.0.18727 > 10.20.112.9.22: Flags [S], seq 3902584450, win 29200, options [mss 1460,sackOK,TS val 58585737 ecr 0,nop,wscale 7], length 0
17:21:24.853506 IP 10.20.43.0.18727 > 10.20.112.9.22: Flags [.], ack 1185451688, win 229, options [nop,nop,TS val 58585738 ecr 3505923357], length 0
17:21:24.853548 IP 10.20.43.0.18727 > 10.20.112.9.22: Flags [F.], seq 0, ack 1, win 229, options [nop,nop,TS val 58585738 ecr 3505923357], length 0
17:21:24.861422 IP 10.20.43.0.18727 > 10.20.112.9.22: Flags [R], seq 3902584452, win 0, length 0
17:21:24.861664 IP 10.20.43.0.18727 > 10.20.112.9.22: Flags [R], seq 3902584452, win 0, length 0
17:21:24.886626 IP 10.20.80.0.24200 > 10.20.112.9.22: Flags [.], ack 3441910184, win 229, options [nop,nop,TS val 721141699 ecr 4136676447], length 0
17:21:24.886681 IP 10.20.80.0.24200 > 10.20.112.9.22: Flags [F.], seq 0, ack 1, win 229, options [nop,nop,TS val 721141699 ecr 4136676447], length 0
17:21:24.894308 IP 10.20.15.0.2797 > 10.20.112.9.22: Flags [.], ack 3295819861, win 229, options [nop,nop,TS val 109245735 ecr 909918859], length 0
17:21:24.894406 IP 10.20.15.0.2797 > 10.20.112.9.22: Flags [F.], seq 0, ack 1, win 229, options [nop,nop,TS val 109245735 ecr 909918859], length 0
17:21:24.895527 IP 10.20.80.0.18382 > 10.20.112.9.22: Flags [.], ack 3481649480, win 229, options [nop,nop,TS val 734681331 ecr 4136676584], length 0
17:21:24.895593 IP 10.20.80.0.18382 > 10.20.112.9.22: Flags [F.], seq 0, ack 1, win 229, options [nop,nop,TS val 734681331 ecr 4136676584], length 0
17:21:24.924502 IP 10.20.109.0.12003 > 10.20.112.9.22: Flags [S], seq 3374047174, win 29200, options [mss 1460,sackOK,TS val 79743823 ecr 0,nop,wscale 7], length 0
17:21:24.982236 IP 10.20.57.0.9545 > 10.20.112.9.22: Flags [.], ack 1704166834, win 229, options [nop,nop,TS val 738481596 ecr 1358622633], length 0
17:21:24.982302 IP 10.20.57.0.9545 > 10.20.112.9.22: Flags [F.], seq 0, ack 1, win 229, options [nop,nop,TS val 738481596 ecr 1358622633], length 0
17:21:24.989253 IP 10.20.15.0.61061 > 10.20.112.9.22: Flags [R], seq 982072414, win 0, length 0
17:21:24.989529 IP 10.20.15.0.61061 > 10.20.112.9.22: Flags [R], seq 982072414, win 0, length 0
17:21:25.018159 IP 10.20.109.0.20837 > 10.20.112.9.22: Flags [R], seq 631530834, win 0, length 0
17:21:25.018446 IP 10.20.109.0.20837 > 10.20.112.9.22: Flags [R], seq 631530834, win 0, length 0
17:21:25.035226 IP 10.20.91.0.61037 > 10.20.112.9.22: Flags [S], seq 2842093164, win 29200, options [mss 1460,sackOK,TS val 103093438 ecr 0,nop,wscale 7], length 0
17:21:25.050073 IP 10.20.15.0.2797 > 10.20.112.9.22: Flags [R], seq 1946192039, win 0, length 0
17:21:25.050392 IP 10.20.15.0.2797 > 10.20.112.9.22: Flags [R], seq 1946192039, win 0, length 0
17:21:25.052613 IP 10.20.80.0.18382 > 10.20.112.9.22: Flags [R], seq 4226089107, win 0, length 0
17:21:25.052964 IP 10.20.80.0.18382 > 10.20.112.9.22: Flags [R], seq 4226089107, win 0, length 0
17:21:25.096099 IP 10.20.109.0.40155 > 10.20.112.9.22: Flags [S], seq 2436452575, win 29200, options [mss 1460,sackOK,TS val 58600734 ecr 0,nop,wscale 7], length 0
17:21:25.097360 IP 10.20.109.0.40155 > 10.20.112.9.22: Flags [.], ack 2593959679, win 229, options [nop,nop,TS val 58600735 ecr 527948207], length 0
17:21:25.097413 IP 10.20.109.0.40155 > 10.20.112.9.22: Flags [F.], seq 0, ack 1, win 229, options [nop,nop,TS val 58600735 ecr 527948207], length 0
17:21:25.106882 IP 10.20.20.0.17960 > 10.20.112.9.22: Flags [R], seq 3130256673, win 0, length 0
17:21:25.107182 IP 10.20.20.0.17960 > 10.20.112.9.22: Flags [R], seq 3130256673, win 0, length 0
17:21:25.107882 IP 10.20.109.0.40155 > 10.20.112.9.22: Flags [R], seq 2436452577, win 0, length 0
17:21:25.108159 IP 10.20.109.0.40155 > 10.20.112.9.22: Flags [R], seq 2436452577, win 0, length 0
17:21:25.130004 IP 10.20.109.0.12003 > 10.20.112.9.22: Flags [.], ack 1402269229, win 229, options [nop,nop,TS val 79743874 ecr 527948036], length 0
17:21:25.130143 IP 10.20.109.0.12003 > 10.20.112.9.22: Flags [F.], seq 0, ack 1, win 229, options [nop,nop,TS val 79743874 ecr 527948036], length 0
17:21:25.140360 IP 10.20.91.0.56862 > 10.20.112.9.22: Flags [S], seq 3594934453, win 29200, options [mss 1460,sackOK,TS val 717100194 ecr 0,nop,wscale 7], length 0
17:21:25.152213 IP 10.20.57.0.9545 > 10.20.112.9.22: Flags [R], seq 4059636484, win 0, length 0
17:21:25.152645 IP 10.20.57.0.9545 > 10.20.112.9.22: Flags [R], seq 4059636484, win 0, length 0
17:21:25.152678 IP 10.20.91.0.61037 > 10.20.112.9.22: Flags [.], ack 1625439664, win 229, options [nop,nop,TS val 103093468 ecr 3721517281], length 0
17:21:25.152787 IP 10.20.91.0.61037 > 10.20.112.9.22: Flags [F.], seq 0, ack 1, win 229, options [nop,nop,TS val 103093468 ecr 3721517281], length 0
17:21:25.169177 IP 10.20.80.0.24200 > 10.20.112.9.22: Flags [R], seq 2003111671, win 0, length 0
17:21:25.169419 IP 10.20.80.0.24200 > 10.20.112.9.22: Flags [R], seq 2003111671, win 0, length 0
17:21:25.186911 IP 10.20.20.0.17480 > 10.20.112.9.22: Flags [S], seq 504571463, win 29200, options [mss 1460,sackOK,TS val 721179477 ecr 0,nop,wscale 7], length 0
17:21:25.245793 IP 10.20.59.0.55465 > 10.20.112.9.22: Flags [S], seq 1573551771, win 29200, options [mss 1460,sackOK,TS val 721141807 ecr 0,nop,wscale 7], length 0
17:21:25.254379 IP 10.20.109.0.52308 > 10.20.112.9.22: Flags [S], seq 1431636156, win 29200, options [mss 1460,sackOK,TS val 717133825 ecr 0,nop,wscale 7], length 0
17:21:25.276638 IP 10.20.91.0.61037 > 10.20.112.9.22: Flags [R], seq 2842093166, win 0, length 0
17:21:25.276913 IP 10.20.91.0.61037 > 10.20.112.9.22: Flags [R], seq 2842093166, win 0, length 0
17:21:25.320344 IP 10.20.91.0.56862 > 10.20.112.9.22: Flags [.], ack 3486584630, win 229, options [nop,nop,TS val 717100239 ecr 3721517386], length 0
17:21:25.320397 IP 10.20.91.0.56862 > 10.20.112.9.22: Flags [F.], seq 0, ack 1, win 229, options [nop,nop,TS val 717100239 ecr 3721517386], length 0
17:21:25.320739 IP 10.20.15.0.10205 > 10.20.112.9.22: Flags [S], seq 2498378351, win 29200, options [mss 1460,sackOK,TS val 738269743 ecr 0,nop,wscale 7], length 0
17:21:25.330260 IP 10.20.20.0.56202 > 10.20.112.9.22: Flags [S], seq 918706737, win 29200, options [mss 1460,sackOK,TS val 58585900 ecr 0,nop,wscale 7], length 0
17:21:25.332162 IP 10.20.15.0.21441 > 10.20.112.9.22: Flags [S], seq 1373914955, win 29200, options [mss 1460,sackOK,TS val 721172454 ecr 0,nop,wscale 7], length 0
17:21:25.333945 IP 10.20.20.0.56202 > 10.20.112.9.22: Flags [.], ack 3073512847, win 229, options [nop,nop,TS val 58585901 ecr 2005722323], length 0
17:21:25.334105 IP 10.20.20.0.56202 > 10.20.112.9.22: Flags [F.], seq 0, ack 1, win 229, options [nop,nop,TS val 58585901 ecr 2005722323], length 0
17:21:25.341221 IP 10.20.109.0.12003 > 10.20.112.9.22: Flags [R], seq 3374047176, win 0, length 0
17:21:25.341523 IP 10.20.109.0.12003 > 10.20.112.9.22: Flags [R], seq 3374047176, win 0, length 0
17:21:25.344918 IP 10.20.20.0.56202 > 10.20.112.9.22: Flags [R], seq 918706739, win 0, length 0
17:21:25.345332 IP 10.20.20.0.56202 > 10.20.112.9.22: Flags [R], seq 918706739, win 0, length 0
17:21:25.361267 IP 10.20.109.0.52308 > 10.20.112.9.22: Flags [.], ack 1866269426, win 229, options [nop,nop,TS val 717133852 ecr 527948366], length 0
17:21:25.361374 IP 10.20.109.0.52308 > 10.20.112.9.22: Flags [F.], seq 0, ack 1, win 229, options [nop,nop,TS val 717133852 ecr 527948366], length 0
17:21:25.363265 IP 10.20.20.0.57788 > 10.20.112.9.22: Flags [S], seq 3437072226, win 29200, options [mss 1460,sackOK,TS val 58612286 ecr 0,nop,wscale 7], length 0
17:21:25.370464 IP 10.20.91.0.9177 > 10.20.112.9.22: Flags [S], seq 2659786995, win 29200, options [mss 1460,sackOK,TS val 287158438 ecr 0,nop,wscale 7], length 0
17:21:25.375819 IP 10.20.20.0.51463 > 10.20.112.9.22: Flags [S], seq 3594559972, win 29200, options [mss 1460,sackOK,TS val 717108568 ecr 0,nop,wscale 7], length 0
17:21:25.416648 IP 10.20.80.0.28166 > 10.20.112.9.22: Flags [S], seq 2615220162, win 29200, options [mss 1460,sackOK,TS val 713857143 ecr 0,nop,wscale 7], length 0
17:21:25.418760 IP 10.20.80.0.28166 > 10.20.112.9.22: Flags [.], ack 19363427, win 229, options [nop,nop,TS val 713857144 ecr 4136677254], length 0
17:21:25.418838 IP 10.20.80.0.28166 > 10.20.112.9.22: Flags [F.], seq 0, ack 1, win 229, options [nop,nop,TS val 713857144 ecr 4136677254], length 0
17:21:25.426316 IP 10.20.80.0.28166 > 10.20.112.9.22: Flags [R], seq 2615220164, win 0, length 0
17:21:25.426563 IP 10.20.80.0.28166 > 10.20.112.9.22: Flags [R], seq 2615220164, win 0, length 0
17:21:25.428544 IP 10.20.80.0.53168 > 10.20.112.9.22: Flags [S], seq 3647896410, win 29200, options [mss 1460,sackOK,TS val 103078696 ecr 0,nop,wscale 7], length 0
17:21:25.463003 IP 10.20.20.0.17480 > 10.20.112.9.22: Flags [.], ack 4058332145, win 229, options [nop,nop,TS val 721179546 ecr 2005722180], length 0
17:21:25.463046 IP 10.20.20.0.17480 > 10.20.112.9.22: Flags [F.], seq 0, ack 1, win 229, options [nop,nop,TS val 721179546 ecr 2005722180], length 0
17:21:25.465105 IP 10.20.91.0.20106 > 10.20.112.9.22: Flags [S], seq 248467239, win 29200, options [mss 1460,sackOK,TS val 713842684 ecr 0,nop,wscale 7], length 0
17:21:25.468930 IP 10.20.91.0.20106 > 10.20.112.9.22: Flags [.], ack 3479727922, win 229, options [nop,nop,TS val 713842686 ecr 3721517711], length 0
17:21:25.469030 IP 10.20.91.0.20106 > 10.20.112.9.22: Flags [F.], seq 0, ack 1, win 229, options [nop,nop,TS val 713842686 ecr 3721517711], length 0
17:21:25.473863 IP 10.20.109.0.52308 > 10.20.112.9.22: Flags [R], seq 1431636158, win 0, length 0
17:21:25.474137 IP 10.20.109.0.52308 > 10.20.112.9.22: Flags [R], seq 1431636158, win 0, length 0
17:21:25.484856 IP 10.20.91.0.20106 > 10.20.112.9.22: Flags [R], seq 248467241, win 0, length 0
17:21:25.485214 IP 10.20.91.0.20106 > 10.20.112.9.22: Flags [R], seq 248467241, win 0, length 0
17:21:25.493198 IP 10.20.20.0.62523 > 10.20.112.9.22: Flags [S], seq 3437622896, win 29200, options [mss 1460,sackOK,TS val 721157372 ecr 0,nop,wscale 7], length 0
17:21:25.506804 IP 10.20.91.0.56862 > 10.20.112.9.22: Flags [R], seq 3594934455, win 0, length 0
17:21:25.507412 IP 10.20.91.0.56862 > 10.20.112.9.22: Flags [R], seq 3594934455, win 0, length 0
17:21:25.523447 IP 10.20.59.0.55465 > 10.20.112.9.22: Flags [.], ack 1705874895, win 229, options [nop,nop,TS val 721141876 ecr 1148138876], length 0
17:21:25.523578 IP 10.20.59.0.55465 > 10.20.112.9.22: Flags [F.], seq 0, ack 1, win 229, options [nop,nop,TS val 721141876 ecr 1148138876], length 0
17:21:25.547811 IP 10.20.80.0.53168 > 10.20.112.9.22: Flags [.], ack 3517567920, win 229, options [nop,nop,TS val 103078725 ecr 4136677266], length 0
17:21:25.547858 IP 10.20.80.0.53168 > 10.20.112.9.22: Flags [F.], seq 0, ack 1, win 229, options [nop,nop,TS val 103078726 ecr 4136677266], length 0
17:21:25.555251 IP 10.20.20.0.51463 > 10.20.112.9.22: Flags [.], ack 464355285, win 229, options [nop,nop,TS val 717108613 ecr 2005722369], length 0
17:21:25.555320 IP 10.20.20.0.51463 > 10.20.112.9.22: Flags [F.], seq 0, ack 1, win 229, options [nop,nop,TS val 717108613 ecr 2005722369], length 0
17:21:25.577941 IP 10.20.91.0.9177 > 10.20.112.9.22: Flags [.], ack 4026992964, win 229, options [nop,nop,TS val 287158490 ecr 3721517617], length 0
17:21:25.578031 IP 10.20.91.0.9177 > 10.20.112.9.22: Flags [F.], seq 0, ack 1, win 229, options [nop,nop,TS val 287158490 ecr 3721517617], length 0
17:21:25.578817 IP 10.20.43.0.39872 > 10.20.112.9.22: Flags [S], seq 1213929003, win 29200, options [mss 1460,sackOK,TS val 734689351 ecr 0,nop,wscale 7], length 0
17:21:25.580397 IP 10.20.109.0.50521 > 10.20.112.9.22: Flags [S], seq 3269918996, win 29200, options [mss 1460,sackOK,TS val 717108875 ecr 0,nop,wscale 7], length 0
17:21:25.596268 IP 10.20.15.0.10205 > 10.20.112.9.22: Flags [.], ack 1891424855, win 229, options [nop,nop,TS val 738269812 ecr 909919432], length 0
17:21:25.596326 IP 10.20.15.0.10205 > 10.20.112.9.22: Flags [F.], seq 0, ack 1, win 229, options [nop,nop,TS val 738269812 ecr 909919432], length 0
17:21:25.608349 IP 10.20.15.0.21441 > 10.20.112.9.22: Flags [.], ack 1641052712, win 229, options [nop,nop,TS val 721172523 ecr 909919443], length 0
17:21:25.608438 IP 10.20.15.0.21441 > 10.20.112.9.22: Flags [F.], seq 0, ack 1, win 229, options [nop,nop,TS val 721172523 ecr 909919443], length 0
17:21:25.645040 IP 10.20.80.0.26920 > 10.20.112.9.22: Flags [S], seq 2891496563, win 29200, options [mss 1460,sackOK,TS val 721132937 ecr 0,nop,wscale 7], length 0
17:21:25.672426 IP 10.20.80.0.53168 > 10.20.112.9.22: Flags [R], seq 3647896412, win 0, length 0
17:21:25.672610 IP 10.20.80.0.53168 > 10.20.112.9.22: Flags [R], seq 3647896412, win 0, length 0
17:21:25.690637 IP 10.20.20.0.57788 > 10.20.112.9.22: Flags [.], ack 2284006145, win 229, options [nop,nop,TS val 58612368 ecr 2005722356], length 0
17:21:25.690827 IP 10.20.20.0.57788 > 10.20.112.9.22: Flags [F.], seq 0, ack 1, win 229, options [nop,nop,TS val 58612368 ecr 2005722356], length 0
17:21:25.692943 IP 10.20.43.0.35049 > 10.20.112.9.22: Flags [S], seq 4078567407, win 29200, options [mss 1460,sackOK,TS val 734646197 ecr 0,nop,wscale 7], length 0
17:21:25.726844 IP 10.20.109.0.27247 > 10.20.112.9.22: Flags [S], seq 775553065, win 29200, options [mss 1460,sackOK,TS val 734668675 ecr 0,nop,wscale 7], length 0
17:21:25.727136 IP 10.20.43.0.39872 > 10.20.112.9.22: Flags [.], ack 1941612673, win 229, options [nop,nop,TS val 734689388 ecr 3505924085], length 0
17:21:25.727213 IP 10.20.43.0.39872 > 10.20.112.9.22: Flags [F.], seq 0, ack 1, win 229, options [nop,nop,TS val 734689388 ecr 3505924085], length 0
17:21:25.739689 IP 10.20.20.0.51463 > 10.20.112.9.22: Flags [R], seq 3594559974, win 0, length 0
17:21:25.739977 IP 10.20.20.0.51463 > 10.20.112.9.22: Flags [R], seq 3594559974, win 0, length 0
17:21:25.749431 IP 10.20.20.0.17480 > 10.20.112.9.22: Flags [R], seq 504571465, win 0, length 0
17:21:25.749885 IP 10.20.20.0.17480 > 10.20.112.9.22: Flags [R], seq 504571465, win 0, length 0
17:21:25.766740 IP 10.20.109.0.50521 > 10.20.112.9.22: Flags [.], ack 3023847199, win 229, options [nop,nop,TS val 717108921 ecr 527948692], length 0
17:21:25.766853 IP 10.20.109.0.50521 > 10.20.112.9.22: Flags [F.], seq 0, ack 1, win 229, options [nop,nop,TS val 717108921 ecr 527948692], length 0
17:21:25.770338 IP 10.20.20.0.62523 > 10.20.112.9.22: Flags [.], ack 3794608256, win 229, options [nop,nop,TS val 721157441 ecr 2005722486], length 0
17:21:25.770397 IP 10.20.20.0.62523 > 10.20.112.9.22: Flags [F.], seq 0, ack 1, win 229, options [nop,nop,TS val 721157441 ecr 2005722486], length 0
17:21:25.784174 IP 10.20.15.0.53987 > 10.20.112.9.22: Flags [S], seq 1575079651, win 29200, options [mss 1460,sackOK,TS val 713842319 ecr 0,nop,wscale 7], length 0
17:21:25.790775 IP 10.20.91.0.9177 > 10.20.112.9.22: Flags [R], seq 2659786997, win 0, length 0
17:21:25.791057 IP 10.20.91.0.9177 > 10.20.112.9.22: Flags [R], seq 2659786997, win 0, length 0
17:21:25.806959 IP 10.20.59.0.55465 > 10.20.112.9.22: Flags [R], seq 1573551773, win 0, length 0
17:21:25.807552 IP 10.20.59.0.55465 > 10.20.112.9.22: Flags [R], seq 1573551773, win 0, length 0
17:21:25.840181 IP 10.20.59.0.26289 > 10.20.112.9.22: Flags [S], seq 2676165097, win 29200, options [mss 1460,sackOK,TS val 721155698 ecr 0,nop,wscale 7], length 0
17:21:25.877260 IP 10.20.15.0.10205 > 10.20.112.9.22: Flags [R], seq 2498378353, win 0, length 0
17:21:25.877562 IP 10.20.15.0.10205 > 10.20.112.9.22: Flags [R], seq 2498378353, win 0, length 0
17:21:25.879106 IP 10.20.43.0.35049 > 10.20.112.9.22: Flags [.], ack 910689031, win 229, options [nop,nop,TS val 734646244 ecr 3505924199], length 0
17:21:25.879216 IP 10.20.43.0.35049 > 10.20.112.9.22: Flags [F.], seq 0, ack 1, win 229, options [nop,nop,TS val 734646244 ecr 3505924199], length 0
17:21:25.881360 IP 10.20.43.0.39872 > 10.20.112.9.22: Flags [R], seq 1213929005, win 0, length 0
17:21:25.881745 IP 10.20.43.0.39872 > 10.20.112.9.22: Flags [R], seq 1213929005, win 0, length 0
17:21:25.889446 IP 10.20.15.0.21441 > 10.20.112.9.22: Flags [R], seq 1373914957, win 0, length 0
17:21:25.889669 IP 10.20.15.0.21441 > 10.20.112.9.22: Flags [R], seq 1373914957, win 0, length 0
17:21:25.913508 IP 10.20.109.0.27247 > 10.20.112.9.22: Flags [.], ack 3798365846, win 229, options [nop,nop,TS val 734668721 ecr 527948838], length 0
17:21:25.913562 IP 10.20.109.0.27247 > 10.20.112.9.22: Flags [F.], seq 0, ack 1, win 229, options [nop,nop,TS val 734668721 ecr 527948838], length 0
17:21:25.921125 IP 10.20.43.0.7138 > 10.20.112.9.22: Flags [S], seq 3883313373, win 29200, options [mss 1460,sackOK,TS val 717134687 ecr 0,nop,wscale 7], length 0
17:21:25.938192 IP 10.20.109.0.64416 > 10.20.112.9.22: Flags [S], seq 1221100315, win 29200, options [mss 1460,sackOK,TS val 103093629 ecr 0,nop,wscale 7], length 0
17:21:25.960816 IP 10.20.109.0.50521 > 10.20.112.9.22: Flags [R], seq 3269918998, win 0, length 0
17:21:25.961123 IP 10.20.109.0.50521 > 10.20.112.9.22: Flags [R], seq 3269918998, win 0, length 0
17:21:25.972978 IP 10.20.80.0.26920 > 10.20.112.9.22: Flags [.], ack 2518107823, win 229, options [nop,nop,TS val 721133019 ecr 4136677482], length 0
17:21:25.973066 IP 10.20.80.0.26920 > 10.20.112.9.22: Flags [F.], seq 0, ack 1, win 229, options [nop,nop,TS val 721133019 ecr 4136677482], length 0
17:21:25.989710 IP 10.20.15.0.53987 > 10.20.112.9.22: Flags [.], ack 1670896067, win 229, options [nop,nop,TS val 713842371 ecr 909919895], length 0
17:21:25.989751 IP 10.20.15.0.53987 > 10.20.112.9.22: Flags [F.], seq 0, ack 1, win 229, options [nop,nop,TS val 713842371 ecr 909919895], length 0
17:21:26.011074 IP 10.20.59.0.26208 > 10.20.112.9.22: Flags [S], seq 963076103, win 29200, options [mss 1460,sackOK,TS val 738277490 ecr 0,nop,wscale 7], length 0
17:21:26.024546 IP 10.20.20.0.57788 > 10.20.112.9.22: Flags [R], seq 3437072228, win 0, length 0
17:21:26.024747 IP 10.20.20.0.57788 > 10.20.112.9.22: Flags [R], seq 3437072228, win 0, length 0
17:21:26.028366 IP 10.20.43.0.7138 > 10.20.112.9.22: Flags [.], ack 2021240246, win 229, options [nop,nop,TS val 717134713 ecr 3505924427], length 0
17:21:26.028497 IP 10.20.43.0.7138 > 10.20.112.9.22: Flags [F.], seq 0, ack 1, win 229, options [nop,nop,TS val 717134713 ecr 3505924427], length 0
17:21:26.043002 IP 10.20.109.0.64416 > 10.20.112.9.22: Flags [.], ack 3643811235, win 229, options [nop,nop,TS val 103093656 ecr 527949049], length 0
17:21:26.043079 IP 10.20.109.0.64416 > 10.20.112.9.22: Flags [F.], seq 0, ack 1, win 229, options [nop,nop,TS val 103093656 ecr 527949049], length 0
17:21:26.059072 IP 10.20.20.0.62523 > 10.20.112.9.22: Flags [R], seq 3437622898, win 0, length 0
17:21:26.059461 IP 10.20.20.0.62523 > 10.20.112.9.22: Flags [R], seq 3437622898, win 0, length 0
17:21:26.076955 IP 10.20.43.0.35049 > 10.20.112.9.22: Flags [R], seq 4078567409, win 0, length 0
17:21:26.077533 IP 10.20.43.0.35049 > 10.20.112.9.22: Flags [R], seq 4078567409, win 0, length 0
17:21:26.106361 IP 10.20.109.0.27247 > 10.20.112.9.22: Flags [R], seq 775553067, win 0, length 0
17:21:26.106695 IP 10.20.109.0.27247 > 10.20.112.9.22: Flags [R], seq 775553067, win 0, length 0
17:21:26.140954 IP 10.20.43.0.7138 > 10.20.112.9.22: Flags [R], seq 3883313375, win 0, length 0
17:21:26.141251 IP 10.20.43.0.7138 > 10.20.112.9.22: Flags [R], seq 3883313375, win 0, length 0
17:21:26.152871 IP 10.20.109.0.64416 > 10.20.112.9.22: Flags [R], seq 1221100317, win 0, length 0
17:21:26.153278 IP 10.20.109.0.64416 > 10.20.112.9.22: Flags [R], seq 1221100317, win 0, length 0
17:21:26.167839 IP 10.20.59.0.26289 > 10.20.112.9.22: Flags [.], ack 3130282776, win 229, options [nop,nop,TS val 721155780 ecr 1148139470], length 0
17:21:26.167940 IP 10.20.59.0.26289 > 10.20.112.9.22: Flags [F.], seq 0, ack 1, win 229, options [nop,nop,TS val 721155780 ecr 1148139470], length 0
17:21:26.199208 IP 10.20.15.0.35812 > 10.20.112.9.22: Flags [S], seq 42430389, win 29200, options [mss 1460,sackOK,TS val 721169596 ecr 0,nop,wscale 7], length 0
17:21:26.200503 IP 10.20.15.0.53987 > 10.20.112.9.22: Flags [R], seq 1575079653, win 0, length 0
17:21:26.200787 IP 10.20.15.0.53987 > 10.20.112.9.22: Flags [R], seq 1575079653, win 0, length 0
17:21:26.288838 IP 10.20.59.0.26208 > 10.20.112.9.22: Flags [.], ack 2718198849, win 229, options [nop,nop,TS val 738277559 ecr 1148139641], length 0
17:21:26.288907 IP 10.20.59.0.26208 > 10.20.112.9.22: Flags [F.], seq 0, ack 1, win 229, options [nop,nop,TS val 738277559 ecr 1148139641], length 0
17:21:26.306139 IP 10.20.80.0.26920 > 10.20.112.9.22: Flags [R], seq 2891496565, win 0, length 0
17:21:26.306328 IP 10.20.80.0.26920 > 10.20.112.9.22: Flags [R], seq 2891496565, win 0, length 0
17:21:26.481826 IP 10.20.91.0.14026 > 10.20.112.9.22: Flags [S], seq 3359538390, win 29200, options [mss 1460,sackOK,TS val 717142873 ecr 0,nop,wscale 7], length 0
17:21:26.500929 IP 10.20.59.0.26289 > 10.20.112.9.22: Flags [R], seq 2676165099, win 0, length 0
17:21:26.501191 IP 10.20.59.0.26289 > 10.20.112.9.22: Flags [R], seq 2676165099, win 0, length 0
17:21:26.516971 IP 10.20.57.0.58550 > 10.20.112.9.22: Flags [S], seq 486364237, win 29200, options [mss 1460,sackOK,TS val 731385641 ecr 0,nop,wscale 7], length 0
17:21:26.523978 IP 10.20.15.0.35812 > 10.20.112.9.22: Flags [.], ack 4255055138, win 229, options [nop,nop,TS val 721169677 ecr 909920310], length 0
17:21:26.524024 IP 10.20.15.0.35812 > 10.20.112.9.22: Flags [F.], seq 0, ack 1, win 229, options [nop,nop,TS val 721169677 ecr 909920310], length 0
17:21:26.551512 IP 10.20.59.0.59288 > 10.20.112.9.22: Flags [S], seq 1433462785, win 29200, options [mss 1460,sackOK,TS val 731640830 ecr 0,nop,wscale 7], length 0
17:21:26.569908 IP 10.20.43.0.31301 > 10.20.112.9.22: Flags [S], seq 3515874440, win 29200, options [mss 1460,sackOK,TS val 713806012 ecr 0,nop,wscale 7], length 0
17:21:26.571570 IP 10.20.43.0.31301 > 10.20.112.9.22: Flags [.], ack 3842275179, win 229, options [nop,nop,TS val 713806012 ecr 3505925076], length 0
17:21:26.571628 IP 10.20.43.0.31301 > 10.20.112.9.22: Flags [F.], seq 0, ack 1, win 229, options [nop,nop,TS val 713806012 ecr 3505925076], length 0
17:21:26.572890 IP 10.20.59.0.26208 > 10.20.112.9.22: Flags [R], seq 963076105, win 0, length 0
17:21:26.573209 IP 10.20.59.0.26208 > 10.20.112.9.22: Flags [R], seq 963076105, win 0, length 0
17:21:26.581491 IP 10.20.43.0.31301 > 10.20.112.9.22: Flags [R], seq 3515874442, win 0, length 0
17:21:26.581772 IP 10.20.43.0.31301 > 10.20.112.9.22: Flags [R], seq 3515874442, win 0, length 0
17:21:26.601493 IP 10.20.91.0.14026 > 10.20.112.9.22: Flags [.], ack 1771529216, win 229, options [nop,nop,TS val 717142903 ecr 3721518728], length 0
17:21:26.601920 IP 10.20.91.0.14026 > 10.20.112.9.22: Flags [F.], seq 0, ack 1, win 229, options [nop,nop,TS val 717142903 ecr 3721518728], length 0
17:21:26.601937 IP 10.20.80.0.63283 > 10.20.112.9.22: Flags [S], seq 2257300268, win 29200, options [mss 1460,sackOK,TS val 717157770 ecr 0,nop,wscale 7], length 0
17:21:26.665039 IP 10.20.57.0.58550 > 10.20.112.9.22: Flags [.], ack 4038192609, win 229, options [nop,nop,TS val 731385678 ecr 1358624331], length 0
17:21:26.665044 IP 10.20.57.0.58550 > 10.20.112.9.22: Flags [F.], seq 0, ack 1, win 229, options [nop,nop,TS val 731385678 ecr 1358624331], length 0
17:21:26.683334 IP 10.20.43.0.29230 > 10.20.112.9.22: Flags [S], seq 3636167428, win 29200, options [mss 1460,sackOK,TS val 734638792 ecr 0,nop,wscale 7], length 0
17:21:26.692156 IP 10.20.57.0.17836 > 10.20.112.9.22: Flags [S], seq 309323610, win 29200, options [mss 1460,sackOK,TS val 734651207 ecr 0,nop,wscale 7], length 0
17:21:26.692230 IP 10.20.20.0.63520 > 10.20.112.9.22: Flags [S], seq 882414290, win 29200, options [mss 1460,sackOK,TS val 738504877 ecr 0,nop,wscale 7], length 0
17:21:26.714264 IP 10.20.59.0.59288 > 10.20.112.9.22: Flags [.], ack 3737039217, win 229, options [nop,nop,TS val 731640870 ecr 1148140182], length 0
17:21:26.714338 IP 10.20.59.0.59288 > 10.20.112.9.22: Flags [F.], seq 0, ack 1, win 229, options [nop,nop,TS val 731640870 ecr 1148140182], length 0
17:21:26.718293 IP 10.20.43.0.27722 > 10.20.112.9.22: Flags [S], seq 3552206639, win 29200, options [mss 1460,sackOK,TS val 717158051 ecr 0,nop,wscale 7], length 0
17:21:26.721313 IP 10.20.80.0.63283 > 10.20.112.9.22: Flags [.], ack 2384639201, win 229, options [nop,nop,TS val 717157800 ecr 4136678439], length 0
17:21:26.721356 IP 10.20.80.0.63283 > 10.20.112.9.22: Flags [F.], seq 0, ack 1, win 229, options [nop,nop,TS val 717157800 ecr 4136678439], length 0
17:21:26.728883 IP 10.20.91.0.14026 > 10.20.112.9.22: Flags [R], seq 3359538392, win 0, length 0
```

**Comment by whereisaaron** [comment]
So it seems like k8s allocates a 10.20.x.0/24 subnet to each node in the cluster, and so 10.20.x.0/32 is the network address for a node. So this appears to all be source-IP rewritten NodePort traffic routed through other nodes. I could move to an `externalTrafficPolicy: local` approach to get more direct visibility of the traffic. Still no sure where this cluster sees this on every NodePort and other clusters don't. But quite probably not a k8s / kube-aws issue so I'll close this for now until I know more.
